PBI-###,Type,Title,Description,AcceptanceCriteria,ReqIDs,NFR_Tags,StoryPoints,Priority,Owner,Sprint,Status,Dependencies,Notes
PBI-098,Task,Do analyze current assignment-validation gap and unresolved flags,"Action to be performed: inspect the current role-assignment implementation, blocker note, and durable docs to isolate exactly which acceptance-criteria paths remain impossible and why. Why it is needed: the team must distinguish completed assignment behavior from work blocked by missing identity and membership source of truth. Expected output: reviewed gap note, explicit remaining behaviors, and constraint list for lookup ownership work. Scope: code-path review, blocker reconciliation, gap note, and dependency map. Explicit exclusions: no new runtime validation logic.","[ReqID: R03] Given the current assignment implementation is reviewed, when the analysis is completed, then the remaining blocked behaviors are explicitly listed against the relevant acceptance criteria. | [ReqID: R03] Given the durable docs and backlog are compared, when the task concludes, then the unresolved flags and required prerequisite decisions are identified without placeholder assumptions.",R03,Maintainability;Architecture,1,P0,Platform Engineer,Sprint 2,Draft,PBI-084;PBI-050,"Important: first execution slice for the blocker spike. Evidence: gap note, dependency map, acceptance-criteria coverage note."
PBI-099,Task,Do map ownership candidates and lookup-boundary options for user identity and organization membership,"Action to be performed: evaluate where user-existence lookup and user-to-organization membership lookup should live in the backend architecture. Why it is needed: role assignment cannot safely resume until lookup ownership is explicit. Expected output: ownership options, proposed boundary, and trade-off note. Scope: boundary options, ownership candidates, adapter direction, and multiplicity impact note. Explicit exclusions: no production lookup implementation.","[ReqID: R03] Given the current architecture is reviewed, when boundary options are compared, then the preferred owner for user lookup and organization-membership lookup is documented. | [ReqID: R03] Given assignment validation depends on these lookups, when the task concludes, then the selected option is justified well enough for implementation follow-up.",R03,Architecture;Maintainability;Integration,1,P0,Platform Engineer,Sprint 2,Draft,PBI-084;PBI-098,"Important: use durable docs as source of truth, not code-only drift. Evidence: boundary options matrix and recommendation."
PBI-100,Task,Do produce approved identity and membership lookup contract proposal and follow-up mapping,"Action to be performed: draft the minimal application-level contracts for user existence lookup and organization-membership lookup and map the exact implementation follow-ups needed. Why it is needed: PBI-085 cannot start cleanly without an approved contract. Expected output: contract proposal, method semantics, ownership note, and follow-up mapping. Scope: interface definitions, expected outcomes, error semantics, and backlog mapping. Explicit exclusions: runtime adapter code.","[ReqID: R03] Given the ownership decision exists, when the contract proposal is finalized, then the lookup interfaces define how the backend determines whether a user exists and whether a user belongs to an organization. | [ReqID: R03] Given follow-up implementation depends on the proposal, when the task closes, then the implementation map and dependent backlog items are explicit.",R03,Architecture;Maintainability;Reliability,1,P0,Platform Engineer,Sprint 2,Draft,PBI-084;PBI-099,"Important: closes the Spike with an executable contract, not just discussion. Evidence: contract diff, follow-up mapping, ownership note."
PBI-101,Task,Do implement application lookup ports for user existence and organization membership,"Action to be performed: add the application-layer ports required to ask whether a user exists and whether a user belongs to an organization. Why it is needed: assignment validation needs executable lookup seams, not only conceptual ownership. Expected output: application interfaces and service-level usage seam. Scope: port definitions, result shapes, and integration seam for role-assignment validation. Explicit exclusions: final infrastructure adapters.","[ReqID: R03] Given the approved lookup contract exists, when the ports are implemented, then the application layer exposes a stable seam for user existence lookup and organization-membership lookup. | [ReqID: R03] Given downstream services consume the ports, when compilation and tests run, then the interfaces are usable without placeholder logic in the assignment service.",R03,Maintainability;Integration;Reliability,2,P0,Backend Engineer,Sprint 2,Draft,PBI-085;PBI-100,Important: first executable slice of the unblocker enabler. Evidence: interface diff and compile-safe consumption seam.
PBI-102,Task,Do implement initial lookup adapters or test seams for identity and organization membership,"Action to be performed: add the initial infrastructure adapters or in-memory test seams that satisfy the new lookup ports. Why it is needed: the assignment service cannot be resumed or tested without executable implementations behind the ports. Expected output: working adapter or test seam for user existence and organization-membership checks. Scope: infrastructure classes, test doubles, and minimal integration wiring. Explicit exclusions: full external identity-provider integration.","[ReqID: R03] Given the lookup ports exist, when the adapters or test seams are added, then the backend can answer whether a user exists and whether that user belongs to an organization. | [ReqID: R03] Given assignment validation needs automated proof, when the task is completed, then the lookup path is usable in tests and later service integration.",R03,Integration;Reliability;Maintainability,2,P0,Backend Engineer,Sprint 2,Draft,PBI-085;PBI-101,Important: keep the implementation minimal but executable. Evidence: adapter tests or service-level seam tests.
PBI-103,Task,Do integrate identity and membership lookups into the role-assignment validation flow,"Action to be performed: wire the approved lookup capabilities into the role-assignment service so invalid-user and non-member paths are enforced. Why it is needed: this is the missing business validation that currently blocks PBI-050 completion. Expected output: assignment service rejects invalid users and users not belonging to the organization. Scope: service integration, validation order, and conflict/validation mapping. Explicit exclusions: UI behavior.","[ReqID: R03] Given a referenced user does not exist, when assignment creation is attempted, then the service rejects the request with the correct error response. | [ReqID: R03] Given a referenced user exists but does not belong to the organization, when assignment creation is attempted, then the service rejects the request with the correct error response.",R03,Reliability;Security;Maintainability,2,P0,Backend Engineer,Sprint 2,Draft,PBI-085;PBI-102;PBI-050,Important: this task resumes the blocked acceptance criteria of PBI-050. Evidence: service tests for invalid-user and non-member paths.
PBI-104,Task,"Do execute lookup-integration tests, docs updates, and evidence for resumed assignment validation","Action to be performed: validate the resumed identity and membership rejection paths, update durable docs if behavior is clarified, and collect evidence. Why it is needed: PBI-050 cannot close on implementation alone. Expected output: automated coverage, evidence bundle, and doc alignment. Scope: application tests, route tests, regression checks, and notes updates. Explicit exclusions: new business behavior beyond the resumed validation paths.","[ReqID: R03] Given lookup integration is complete, when automated tests run, then invalid-user and non-member rejection paths are covered without breaking existing successful assignment behavior. | [ReqID: R03] Given the resumed validation changes contract or state understanding, when the task closes, then the relevant durable docs are updated and evidence is attached.",R03,Quality;Maintainability;Audit,1,P0,QA Lead,Sprint 2,Draft,PBI-085;PBI-103;PBI-050,Important: evidence task for the resumed blocked slice. Include route-level error cases and assignment success regression.
PBI-105,Task,Do inventory current actor-source usage in protected routes and audit emitters,"Action to be performed: inspect where protected routes and audit emitters currently source actor identity. Why it is needed: the actor-boundary spike must start from current implementation truth, not assumption. Expected output: actor-source inventory and route impact list. Scope: route handlers, audit calls, request headers, and current actor derivation patterns. Explicit exclusions: auth-boundary implementation.","[ReqID: R03;R20;R22] Given the current codebase is reviewed, when the inventory is completed, then all protected routes and audit emitters relying on actor identity are listed. | [ReqID: R03;R20;R22] Given current implementations may differ, when the task closes, then the places that still depend on raw client-supplied actor data are explicitly identified.",R03;R20;R22,Architecture;Audit;Maintainability,1,P0,Platform Engineer,Sprint 2,Draft,PBI-086,Important: first slice of the actor-boundary spike. Evidence: route inventory and actor-source matrix.
PBI-106,Task,Do produce approved trusted actor-context boundary and migration proposal,"Action to be performed: define the approved request-context boundary for trusted actor data and map the route/audit migration steps. Why it is needed: follow-up implementation must converge on one request-actor pattern. Expected output: approved actor-context contract, migration note, and affected-route map. Scope: request context shape, middleware/plugin boundary, migration steps, and backlog impact. Explicit exclusions: actual middleware code.","[ReqID: R03;R20;R22] Given the actor-source inventory exists, when the proposal is finalized, then the trusted actor-context boundary and route-consumption pattern are explicitly defined. | [ReqID: R03;R20;R22] Given downstream hardening depends on this decision, when the task closes, then affected routes and follow-up implementation work are identified clearly.",R03;R20;R22,Architecture;Security;Maintainability,1,P0,Platform Engineer,Sprint 2,Draft,PBI-086;PBI-105,Important: closes the actor-boundary spike with a migration-ready proposal.
PBI-107,Task,Do implement shared request actor-context middleware or plugin,"Action to be performed: add the shared backend mechanism that populates trusted actor context into the request lifecycle. Why it is needed: protected routes and audits need a common trusted source rather than raw client headers. Expected output: request actor context mechanism and route-consumption seam. Scope: middleware/plugin, request typing, actor-context population, and integration seam. Explicit exclusions: full external identity-provider rollout.","[ReqID: R03;R20;R22] Given the approved actor-boundary proposal exists, when the middleware or plugin is implemented, then protected routes can read trusted actor context from the request lifecycle. | [ReqID: R03;R20;R22] Given the mechanism is in place, when build and tests run, then route handlers have a stable actor-context seam without direct dependence on raw client actor headers.",R03;R20;R22,Security;Integration;Maintainability,2,P0,Backend Engineer,Sprint 2,Draft,PBI-087;PBI-106,Important: first executable slice of the auth-derived actor enabler. Evidence: middleware/plugin tests and route-consumption example.
PBI-108,Task,Do refactor protected route consumers and audit emitters to use trusted actor context,"Action to be performed: update protected route handlers and audit emitters to consume the new request actor context. Why it is needed: the shared actor-boundary enabler is incomplete until downstream consumers stop relying on raw request headers. Expected output: protected backend consumers use trusted actor context consistently. Scope: route refactors, audit emitter wiring, and negative-path safety checks. Explicit exclusions: UI auth flows.","[ReqID: R03;R20;R22] Given the actor-context mechanism exists, when protected routes execute, then authorization and audit code read actor information from the trusted request context. | [ReqID: R03;R20;R22] Given legacy raw-header consumption remains in affected routes, when the task is completed, then those routes are migrated or explicitly isolated for later work.",R03;R20;R22,Security;Audit;Maintainability,2,P0,Backend Engineer,Sprint 2,Draft,PBI-087;PBI-107,Important: route migration task; keep affected-route list explicit from PBI-106.
PBI-109,Task,"Do execute actor-context integration tests, route hardening checks, and docs updates","Action to be performed: validate the trusted actor-context path, update docs where actor handling changes, and collect evidence. Why it is needed: actor-boundary work is cross-cutting and must be proven. Expected output: tests, docs updates, and evidence for protected route consumption. Scope: integration tests, negative authorization checks, docs, and evidence. Explicit exclusions: unrelated auth-provider work.","[ReqID: R03;R20;R22] Given the actor-context refactor is complete, when integration and route tests run, then protected routes and audits behave correctly with trusted actor context. | [ReqID: R03;R20;R22] Given actor handling changed, when the task closes, then durable docs and evidence reflect the new trusted actor path.",R03;R20;R22,Quality;Audit;Maintainability,1,P0,QA Lead,Sprint 2,Draft,PBI-087;PBI-108,Important: required before broader authorization hardening is considered done.
PBI-110,Task,Do inventory current success and denied-action audit behavior across protected routes,"Action to be performed: inspect protected routes to catalog what is currently audited for success, forbidden, invalid, and denied outcomes. Why it is needed: audit-policy standardization must start from real implementation behavior. Expected output: route audit inventory and inconsistency list. Scope: current audit events, denied-action paths, and missing payload fields. Explicit exclusions: route refactor work.","[ReqID: R22;R03;R20] Given current protected routes are reviewed, when the inventory is completed, then audit behavior for success and denied outcomes is explicitly listed. | [ReqID: R22;R03;R20] Given inconsistency exists across modules, when the task closes, then the main policy gaps are documented for decision.",R22;R03;R20,Audit;Architecture;Maintainability,1,P1,Security Engineer,Sprint 2,Draft,PBI-090,Important: first slice of the audit-policy spike. Evidence: audit inventory and inconsistency note.
PBI-111,Task,Do produce approved denied-action audit policy and minimum payload definition,"Action to be performed: define the approved policy for auditing denied protected actions and the minimum payload required. Why it is needed: route hardening and deactivation work need one consistent audit rule. Expected output: approved policy note, minimum payload, and application guidance. Scope: success vs denied behavior, required fields, route application rule, and follow-up mapping. Explicit exclusions: broad implementation refactor in this task.","[ReqID: R22;R03;R20] Given the audit inventory exists, when the policy is approved, then success and denied-action audit behavior is defined consistently. | [ReqID: R22;R03;R20] Given downstream implementation depends on the policy, when the task closes, then the minimum payload and affected route classes are explicitly documented.",R22;R03;R20,Audit;Compliance;Architecture,1,P1,Security Engineer,Sprint 2,Draft,PBI-090;PBI-110,Important: closes the audit-policy spike with an implementation-ready rule set.
PBI-112,Task,Do define common API error-envelope contract for validation and application failures,"Action to be performed: define the standard response structure for schema-validation errors and application-validation errors. Why it is needed: API consistency is currently uneven and will complicate resumed UI/API consumption. Expected output: approved common error-envelope structure and mapping rules. Scope: envelope fields, error categories, route-application rule, and contract note. Explicit exclusions: route implementation changes.","[ReqID: R03;R20] Given API failures are reviewed, when the contract is approved, then schema and application validation failures share a consistent error-envelope structure. | [ReqID: R03;R20] Given later route refactoring depends on the contract, when the task closes, then the mapping rules are explicit enough for implementation.",R03;R20,Maintainability;Integration;Usability,1,P1,Platform Engineer,Sprint 2,Draft,PBI-089,Important: first slice of the error-envelope enabler. Evidence: contract diff and example envelopes.
PBI-113,Task,Do implement shared error-envelope mapping helper for route and application failures,"Action to be performed: add the shared mapping/helper mechanism that produces the approved error envelope across routes. Why it is needed: consistency cannot be achieved safely through route-by-route ad hoc formatting. Expected output: reusable error-envelope mapping/helper. Scope: helper implementation, integration seam, and automated coverage. Explicit exclusions: full retrofit of all routes in this task.","[ReqID: R03;R20] Given the approved error-envelope contract exists, when the helper is implemented, then routes and application failures can emit the same envelope shape through a shared mechanism. | [ReqID: R03;R20] Given the helper is used in tests, when validation fails, then the returned structure matches the approved error contract.",R03;R20,Maintainability;Reliability;Integration,2,P1,Backend Engineer,Sprint 2,Draft,PBI-089;PBI-112,Important: shared implementation slice before route retrofit.
PBI-114,Task,Do retrofit priority backend routes to the common error envelope and update tests/docs,"Action to be performed: apply the common error-envelope helper to the highest-priority backend routes and align tests and docs. Why it is needed: the enabler is not useful until real routes consume it. Expected output: selected routes return consistent validation/application-failure envelopes. Scope: route retrofit, tests, and docs updates for priority flows. Explicit exclusions: full repo-wide retrofit in one task.","[ReqID: R03;R20] Given the shared helper exists, when selected priority routes are refactored, then their validation and application failures return the approved common envelope. | [ReqID: R03;R20] Given route behavior changes, when the task closes, then tests and API docs reflect the new envelope consistently.",R03;R20,Reliability;Maintainability;Usability,2,P1,Backend Engineer,Sprint 2,Draft,PBI-089;PBI-113,"Important: choose priority routes deliberately, starting with membership and shariah submission flows if pulled this sprint."
PBI-115,Task,"Do add repository CI workflow for install, test, and build execution","Action to be performed: create the repository-native CI workflow that runs install, test, and build on change. Why it is needed: local-only validation is not sufficient as a sprint quality gate. Expected output: CI pipeline file and successful baseline execution path. Scope: workflow config, install/test/build steps, and failure visibility. Explicit exclusions: deployment automation.","[ReqID: R25;R26] Given a change is pushed or proposed, when CI runs, then install, test, and build steps execute automatically. | [ReqID: R25;R26] Given one of the quality gates fails, when CI completes, then the failure is surfaced in the pipeline result.",R25;R26,Reliability;Operability;Maintainability,2,P1,DevOps Engineer,Sprint 2,Draft,PBI-092,Important: first slice of the CI enabler. Evidence: workflow file and successful baseline run.
PBI-116,Task,Do verify CI and local execution parity and document contributor expectations,"Action to be performed: verify the CI workflow matches the intended local commands and document contributor expectations. Why it is needed: a pipeline without contributor parity creates false failures and weak adoption. Expected output: parity check, script alignment note, and contributor guidance. Scope: command parity, expected environment notes, and documentation update. Explicit exclusions: new pipeline stages beyond the baseline quality gate.","[ReqID: R25;R26] Given the CI workflow exists, when parity is checked, then the CI commands align with supported local execution for install, test, and build. | [ReqID: R25;R26] Given contributors use the repository, when they read the guidance, then the expected local commands and CI behavior are explicit.",R25;R26,Maintainability;Operability;Documentation,1,P1,DevOps Engineer,Sprint 2,Draft,PBI-092;PBI-115,Important: closes the CI enabler with usable contributor guidance.
PBI-117,Task,Do inventory protected functions and deactivation effects across current backend flows,"Action to be performed: review current backend flows to identify which actions and reads are protected and what deactivation should do to each. Why it is needed: deactivation enforcement and audit behavior cannot be implemented safely without an explicit protected-function inventory. Expected output: protected-function inventory and deactivation-effect note. Scope: protected writes, sensitive reads, deny expectations, and affected modules. Explicit exclusions: enforcement code changes.","[ReqID: R03;R22] Given the current backend flows are reviewed, when the inventory is completed, then the protected actions and relevant reads are explicitly listed. | [ReqID: R03;R22] Given deactivation behavior varies by function, when the task closes, then expected allow/deny effects are documented by function class.",R03;R22,Security;Architecture;Maintainability,1,P1,Security Engineer,Sprint 2,Draft,PBI-095,Important: first slice of the deactivation-policy spike. Evidence: protected-function inventory and effect matrix draft.
PBI-118,Task,Do produce approved protected-function matrix and deactivation carry-over implementation map,"Action to be performed: finalize the protected-function matrix and map which deactivation tasks can proceed after the policy is approved. Why it is needed: backend deactivation enforcement should not repeat the same semantic deadlock seen in assignment validation. Expected output: approved matrix, deactivation-effect rules, and carry-over implementation map. Scope: matrix finalization, implementation map, and audit linkage note. Explicit exclusions: actual enforcement code beyond planning boundaries.","[ReqID: R03;R22] Given the protected-function inventory exists, when the matrix is approved, then the set of protected actions and deactivation behavior is explicitly defined. | [ReqID: R03;R22] Given deactivation implementation depends on the matrix, when the task closes, then the carry-over path into PBI-054, PBI-055, and PBI-057 is clearly mapped.",R03;R22,Security;Audit;Architecture,1,P1,Security Engineer,Sprint 2,Draft,PBI-095;PBI-117,Important: closes the deactivation-policy spike with an implementation-ready matrix.
